<?xml version="1.0" encoding="UTF-8" standalone="no"?>
<?xml-stylesheet href="catalog_20048957.css" type="text/css"?>
<!-- 
    Name: Pratik Shrestha
    LondonMetID: 20048957
    Group: L2C3
    Store Name: Niney Gift Card Store
-->

<gift_card_store xsi:noNamespaceSchemaLocation="catalog_20048957.xsd" xmlns:xsi="http://www.w3.org/2001/XMLSchema-instance">
    <store_detail>
        <store_information>
            <store_info>
                <owner>NINEY</owner>
                <location>Enfield, London</location>
                <website> www.giftstore.com.uk</website>
            </store_info>
            <gift_logo id="gift" />
        </store_information>
        <search_bar>Search for Brand and Product</search_bar>
        <user_credentials>
            <sign_up>Sign In </sign_up>
            <return>Return  &#38; Orders</return>
            <login>Log In</login>
        </user_credentials>
    </store_detail>

    <store_menuBar>
        <menu_list>Home</menu_list>
        <menu_list>Software</menu_list>
        <menu_list>Gift card</menu_list>
        <menu_list>Game card</menu_list>
        <menu_list>Deals</menu_list>
        <menu_list>Promo</menu_list>
    </store_menuBar>

    <gift_introduction>
        <gift_description>
            <description_heading>
                <![CDATA[Buy and Send Gift Cards Instantly]]>
            </description_heading>
            <description_paragraph>
                <![CDATA[Buy premium gift cards and send by email, text, or hand deliver.]]>
            </description_paragraph>
            <buyButton>Buy gift card</buyButton>
        </gift_description>
    </gift_introduction>

    <offical_partner>
        <partnersIntroduction>
            <![CDATA[Our Official Sponsors and partners]]>
        </partnersIntroduction>
        <partnersImages>
            <partnersImage id="amazonImage"></partnersImage>
            <partnersImage id="googleImage"></partnersImage>
            <partnersImage id="microsoftImage"></partnersImage>
            <partnersImage id="spotifyImage"></partnersImage>
            <partnersImage id="appleImage"></partnersImage>
            <partnersImage id="netflixImage"></partnersImage>
            <partnersImage id="itunesImage"></partnersImage>
            <partnersImage id="xboxImage"></partnersImage>
            <partnersImage id="tensentImage"></partnersImage>
        </partnersImages>
    </offical_partner>

    <gift_card_text>
        <gift_card_panel>Shop from Hundreds of Gift Cards</gift_card_panel>
        <gift_card_label>Buy, Send and Claim Gift Cards. Chip in with Friends. Store and Manage Gift Cards.</gift_card_label>
    </gift_card_text>

    <gift_cards>
        <gift_card giftID="gID1">
            <image>
                <card_image id="netflix"></card_image>
            </image>
            <description>
                <name type="Digital">Netflix</name>
                <service_type class="subscription">Streaming service</service_type>
                <cost currency="USD">50</cost>
                <digital_code>G9#####</digital_code>
                <generated>2021-09-20</generated>
                <validity>Upto 6 months</validity>
                <availability>10</availability>
                <numbers_of_user>4</numbers_of_user>
                <discount>5</discount>
                <region>Global</region>
                <manufacturer platform="video streaming">Netflix</manufacturer>
                <refundable>1 Day return</refundable>
            </description>
        </gift_card>
        <gift_card giftID="gID2">
            <image>
                <card_image id="spotify"></card_image>
            </image>
            <description>
                <name type="Physical">Spotify</name>
                <service_type class="subscription">Audio streaming service</service_type>
                <cost currency="USD">105</cost>
                <generated>2021-07-10</generated>
                <validity>Upto 12 months</validity>
                <availability>12</availability>
                <numbers_of_user>4</numbers_of_user>
                <region>Global</region>
                <manufacturer platform="Audio streaming">Spotify</manufacturer>
                <reloadable>true</reloadable>
                <refundable>2 Day return</refundable>
            </description>
        </gift_card>

        <gift_card giftID="gID3">
            <image>
                <card_image id="amazon"></card_image>
            </image>
            <description>
                <name type="Digital">Amazon prime</name>
                <service_type class="subscription">Streaming service</service_type>
                <cost currency="USD">100</cost>
                <digital_code>AP9#####</digital_code>
                <generated>2021-06-20</generated>
                <validity>Upto 4 months</validity>
                <availability>19</availability>
                <numbers_of_user>4</numbers_of_user>
                <discount>6</discount>
                <region>Global</region>
                <manufacturer platform="video streaming">Amazon </manufacturer>
                <refundable>2 Day return</refundable>
            </description>
        </gift_card>
        <gift_card giftID="gID4">
            <image>
                <card_image id="itunes"></card_image>
            </image>
            <description>
                <name type="Digital">i-Tunes</name>
                <service_type class="subscription">Audio Streaming service</service_type>
                <cost currency="USD">100</cost>
                <digital_code> iT3#####</digital_code>
                <generated> 2021-12-12</generated>
                <availability>19</availability>
                <validity>Upto 6 months</validity>
                <numbers_of_user> 4</numbers_of_user>
                <discount>5</discount>
                <region>Global</region>
                <manufacturer platform="audio streaming"> Netflix</manufacturer>
                <refundable> 1 Day return</refundable>
            </description>
        </gift_card>
        <gift_card giftID="gID5">
            <image>
                <card_image id="pubg"></card_image>
            </image>
            <description>
                <name type="Digital">PUBG</name>
                <service_type class="subscription">Gaming service</service_type>
                <cost currency="USD">50</cost>
                <digital_code>p12#####</digital_code>
                <generated>2021-07-25</generated>
                <validity>unlimited</validity>
                <availability>26</availability>
                <numbers_of_user>1</numbers_of_user>
                <region>Global</region>
                <manufacturer platform="gaming platform">tencent</manufacturer>
                <refundable>1 Day return</refundable>
            </description>
        </gift_card>
        <gift_card giftID="gID6">
            <image>
                <card_image id="ps4"></card_image>
            </image>
            <description>
                <name type="Digital">PS-4</name>
                <service_type class="subscription">Gaming service</service_type>
                <cost currency="USD">100</cost>
                <digital_code>PS1#####</digital_code>
                <generated>2022-02-21</generated>
                <validity>Upto 6 months</validity>
                <availability>10</availability>
                <numbers_of_user>4</numbers_of_user>
                <discount>5</discount>
                <region>Global</region>
                <manufacturer platform="gaming platform">Netflix</manufacturer>
                <refundable>1 Day return</refundable>
            </description>
        </gift_card>
        <gift_card giftID="gID7">
            <image>
                <card_image id="leagueoflegend"></card_image>
            </image>
            <description>
                <name type="Digital">leagueoflegend</name>
                <service_type class="subscription">Gaming service</service_type>
                <cost currency="USD"> $25</cost>
                <digital_code>LOL2#####</digital_code>
                <generated>2021-09-15</generated>
                <validity>unlimited</validity>
                <availability>3</availability>
                <numbers_of_user>1</numbers_of_user>
                <region>Global</region>
                <manufacturer platform="gaming platform">Riot Games Corporation</manufacturer>
                <refundable>1 Day return</refundable>
            </description>
        </gift_card>
        <gift_card giftID="gID8">
            <image>
                <card_image id="roblox"></card_image>
            </image>
            <description>
                <name type="Digital">Roblox</name>
                <service_type class="subscription">Gaming service</service_type>
                <cost currency="USD"> $20</cost>
                <digital_code>R02#####</digital_code>
                <generated>2021-04-15</generated>
                <validity>unlimited</validity>
                <availability>29</availability>
                <numbers_of_user>1</numbers_of_user>
                <region>Global</region>
                <manufacturer platform="gaming platform">Roblox Corporation</manufacturer>
                <refundable>1 Day return</refundable>
            </description>
        </gift_card>
        <gift_card giftID="gID9">
            <image>
                <card_image id="office365"></card_image>
            </image>
            <description>
                <name type="Physical">Netflix</name>
                <service_type class="subscription">Streaming service</service_type>
                <cost currency="USD">125</cost>